{
  "run_id": "mock-2026-05-28-clerk-001",
  "source_name": "Broward Official Records / NOC",
  "adapter_type": "SFTP",
  "mode": "mock",
  "started_at": "2026-05-28T14:06:00Z",
  "finished_at": "2026-05-28T14:06:08Z",
  "status": "pass",
  "records_fetched": 247,
  "records_parsed": 241,
  "records_rejected": 6,
  "errors": [],
  "warnings": [
    "6 records had malformed parcel_id format - quarantined"
  ],
  "raw_snapshot_file": "data/mock_adapters/broward_clerk_mock.json",
  "parsed_output_file": "data/mock_runs/clerk_noc_parsed_2026-05-28-001.json",
  "provenance": {
    "source_system": "Broward bcftp.broward.org (simulated daily Official_Records_Download)",
    "source_fetched_at": "2026-05-28T14:06:00Z",
    "import_run_id": "mock-2026-05-28-clerk-001",
    "fetcher_version": "mock-harness-v0.1",
    "sandbox_only": true
  },
  "no_write_guarantee": true,
  "live_calls_performed": false,
  "contract_version": "v0.2",
  "notes": "Mock SFTP file parse. ~260 NOC/day per Claude audit. No actual SFTP connection made."
}
